33,,Aşgabat agrosenagat orta hünär okuw mekdebi,10,Maslahatlary geçirmegiň ähmiýeti bilim ulgamy bilen önümçiligi golaýlaşdyrmakda uly ähmiýete eýe bolýar,Talyplaryň alýan nazary bilimlerini iş ýüzünde ulanmaklary bilen baglylykda dürli taslamalaryň üstünde işlemeklerini guramak,"Bilim edaralarynyň döwrebap enjamlar bilen enjamlaşdyrylmagyny gowulandyrmak, talyplaryň amaly endiklerini ösdürmäge bolan mümkinçiliklerini ýaýbaňlandyrmak.",,,"Sanly tehnologiýalaryň ulanylyşyny has-da ýaýbaňlandyrmak, onlaýn kurslary artdyrmak, hyzmatdaşlyk platformalaryny we wirtual laboratoriýalary giňden ulanmaklygy guramak, emeli aňyň mümkinçiliklerinden peýdalanmak",,,,,,,,,,,
34,,S.A.Nyýazow adyndaky Türkmen oba hojalyk uniwersitetiniň Baýramaly agrosenagat orta hünär okuw mekdebi,6,Geçirilýän maslahatlaryň gerimini giňeltmeli,Okatmagyň sanly usullaryny ornaşdyrmagy dowam etmeli,,,,Göçme amaly-tejribe okuwlary köp gurnamaly,,,,,,"1) Ýaşlarymyzda milli däplerimize söýgüni terbilemelei;
2) Talyp ýaşlaryň gadymy ýadygärliklere gezelençleriniň sanyny artdyrmaly",Gahryman Arkadagymyzyň hem-de Arkadagly Gahryman Serdarymyzyň halkymyza peşgeş beren kitaplaryndan berilýän gymmatly maglumatlary degişli dersleriň okuw maksatnamalaryna girizmegi dowam etmeli,,,,
35,,S.A.Nyýazow adyndaky Türkmen oba hojalyk uniwersitetiniň Türkmenabat agrosenagat orta hünär okuw mekdebi,5,Geçirilýän maslahatlaryň  ýokary ähmiýetini göz öňünde tutup maslahatlaryň yzygider geçirilmegini gurnamaly ,,Mekdepde DUAL bilim maksatnamalary boýunça dual okuwlary girizmeli,,,"tehnikanyň örän çalt depginlerde ösmegi, täze tehnologiýalaryň döreýänligi sebäpli mekdebde okuw üçin peýdalanylýan tehnologiýalary kämilleşdirmeli we bu tehnologiýalardan baş çykarýan ýaş hünärmenleri işe çekmeli",,,,,,"Halypaçylyk sagatlarynda talyplar bilen  ýaş nesilleri milli gymmatlyklarymyza, däp-dessurlarymyza buýsanç ruhunda, ynsanperwer kadalarymyz esasynda terbiýelemek üçin meşhur şahsyýetlerimiz barada söhbetdeşlik geçmeli","Müňýyllyklardan gözbaş alýan medeniýetimiz, edebiýatymyz, şöhratly taryhymyz barada maglumat  toplumyny döretmeli we mekdebiň içki portalyna ýerleşdirmeli. Talyplar tarapyndan yzygider öwrenilmegini gazanmaly",,,,
36,,Türkmen oba hojalyk institutynyň Daşoguz agrosenagat orta hünär okuw mekdebi,5,,Mekdep okuwçylary              10-njy synpdan   soňra  başlangyç  orta  hünär bilim edaralara okuwa kabul edilmäge rugsat bermek ,Ykdysadyýete dakylly önümçiligik edara kärhanalar bilen hyzmatdaşlygy guramak,"Tölegli okaýan zehinli, göreldeli talyplara ""atly talyp haklaryny"" bermek",,Zähmete ukyplylygy çäkli ýaşlar üçin onlaýn hünär bilimiň elýeterliligini üpjün etmek,,,,,,Meşhur şahsyýetler heýkelerini bilim  edaralaryň çäginde ýerleşdirmek ,,,,,
37,,“Türkmennebit” döwlet konserniniň Balkanabat nebitçilik orta hünär okuw mekdebi,60,,"Ýaşlary telekeçilik işine çekmek üçin ýokary synp mekdep okuwçylary we talyp ýaşlar bilen önüm öndürýän hususy kärhanalarda tejribe okuw sapaklaryny, wagyz-nesihat çärelerini geçirmeli.",Işlejek ýaşlar üçin ýaşaýyş jaýlaryny gurmaly.,,,Mekdeplerde daşary ýurt dillerini öwrenek üçin sagatlaryň sanyny köpeltmeli.,,Ýurdumyzda döwrebap häzirki zaman tehnologiýalar merkezini döretmel,,,Ýokary okuw mekdeplerinde ylym-bilim-önümçilik arabaglanyşygynyň kämil usulyny döretmeli.,Edara-kärhanalarda zähmet çekýän raýatlarymyzyň arasynda kanunçylyga girizilýän üýtgetmeler barada wagyz-nesihat işlerini geçirmeli.,,,,,
38,,“Türkmengaz” döwlet konserniniň Mary nebitgaz orta hünär okuw mekdebi,8,"Ýaşlaryň özbaşdak okamaklary üçin dürli elektron resurslary we programmalar bilen üpjün edilen bilimiň sanly klasterini döretmek netijeli bolar. Bu resurslaryň arasynda online kurslar, wideolar we okuw kitaplary hem bolup biler","Interaktiw we taslama esasly okuw: Teoriýany dürli taslamalar arkaly öwretmek, häzirki zaman okuw metodikasy hökmünde işjeň ulanylýar. Talyplar aragatnaşyk ýaýlymlarynyň dürli aspektlerini özbaşdak gözden geçirip, çözgüt döretmek ukyplaryny ösdürip bilerler",Robot tehnikasy we emeli ugurlary boýunça hünärmenleri taýýarlamaly,"Maliýe gözegçiligi: Maliýe analizini we gözegçiligini ýokarlandyrmak, şeýle hem harajatlary we girdejilere gözegçilik etmek üçin döwrebap programma üpjünçiliklerini ulanmak",,Ylmyň güýçli depginler bilen ösýän döwründe mugallymlaryň hünärini ýokarlandyrmak üçin tejribe bilen baglanşykly hünäri ýokarlandyryş okuwlaryny yzygiderli gurnamak,,"Innowasiýalar we barlag işleri: Bu ugurda ylmy-barlag taslamalaryny we innowasiýa işleri guramak, talyplaryň täze ideýalary öwrenip, öňdebaryjy çözgütler bilen tanyşmagyna şert döreder",,,,"Şöhratly taryhymyzy, edebiýatymyzy içgin öwrenmek maksady bilen, talyplaryň arasynda “BOOKCROSSING” hereketini ýola goýmaly","Müňýyllyklardan gözbaş alýan medeniýetimizi, edebiýatymyzy, şöhratly taryhymyzy öwretmekde ylmy işgärleriň gatnaşmagynda ýygy-ýygydan sergiler, duşuşyklar gurnalsa",,,,
39,,Aşgabat şäherindäki demir ýol ulaglary orta hünär okuw mekdebi,14,,,"
• Okuw meýilnamalaryny döwrebaplaşdyrmak: Her derejede bilim maksatnamalaryny döwrebaplaşdyryp, okuwçylara we talyplara häzirki zaman talaplaryna laýyk bilim bermek;  
 Türkmenistanyň Prezidentiniň ýurdumyzy “2022-2028-nji  ýyllarda  durmuş-ykdysady taýdan  ösdürmegiň  Maksatnamasynda”  demir ýol  ulgamyny  döwrebaplaşdyrmak, elektrikleşdirmek, dolandyryş  ulgamyny  kämilleşdirmek  hem-de  hünärmenleri taýýarlamak  işler göz öňünde tutulyp, bu ugurda  zerur çäreleriň durmuşa  geçirilýändigini nazara alyp, okatmagyň usulyýetini kämilleşdirmek  maksady bilen,  orta hünär okuw mekdebiniň okuw meýilnamalaryny  kämilleşdirmek.

•  Sanly bilim tehnologiýalaryndan peýdalanmak: Bilim edaralarynyň sanly tehnologiýalardan peýdalanmak derejesi.
Bu maksatlar we görkezijiler bilen, bilim ulgamynyň ösüşini giňeltmek we ýurduň bilim çägini halkara derejesinde bäsleşige ukyply etmek üçin güýçli esas döretmek mümkin bolar.
",,,"•   Döwlet we hususy pudaklaryň hünärmenleri bilen hyzmatdaşlyk: Tejribeli hünärmenleriň pudaklar boýunça ýörite okuw sapaklaryna gatnaşmagyny ýola goýmak, talyplara hnärmenleriň hakyky iş tejribelerini öwrenmäge mümkinçilik berer. Şeýle çäreler talyplaryň okuw prosesi üçin gymmatly maglumatlary öwrenmegine itergi berer.
•   Tehnologiýa öwreniş merkezlerini döretmek: Täze tehnologiýalaryň täsirini öwrenmek we özleşdirmek üçin ýokary okuw mekdeplerinde ýörite tehnologiýa öwreniş merkezlerini döretmek we kämilleşdirmek. Bu merkezlerde talyplar täze tehnologiýalary synap görerler, şeýle taslamalara gatnaşyp, hakyky tejribe gazanarlar.
Bu usulyýetler talyplaryň häzirki döwrüň çalt ösýän tehnologik talaplaryna laýyk bilim almaklaryny üpjün eder. Şeýle çemeleşme bilen, olar okuwlaryny tamamlap, iş prosesine girişenlerinde täze tehnologiýalary ulanmakda gowy taýýarlyga eýe bolarlar.

",,"•   Innowasiýa Bilim kompleksleri: Döwrebap bilim edaralaryny gurup, olaryň düzüminde ylmy innowasion tehnologiýalaryny kämilleşdirmek boýunça ylmy barlag işleriniň şertini giňeltmek. Ýokary okuw mekdepleriň ýanynda innowasion bilim merkezlerini we barlaghanalary döretmek.
 Bu teklipler pudaklary ýokary derejede döwrebaplaşdyrmak we sanlylaşdyrmak bilen birlikde, howpsuzlygy üpjün etmäge, we täze nesil hünärmenleri taýýarlaýan  meýilnama üçin amatly esas bolar. Şeýle merkezlerini döretmek bilen, ýurtda pudaklary ylym we tehnologiýa taýdan ösmekde dünýä bilen bäsleşige ukyply etmek mümkin bolar.
",,,"• Tehnologiýa we maglumat alyşmak boýunça seminarlar we okuwlar: Kärhanalar bilen bilelikde seminarlary, ylmy maslahatlary we maglumat alyşmak boýunça okuwlary geçirmegi ýola goýmak,  okuw jaýlarynda täze bilimleriň we tehnologiýalaryň öwrenilmegine we önümçilikde peýdalanylmagyna ýol açar;
Ýokary okuw mekdeplerinde ylym-bilim-önümçilik arabaglanyşygynyň kämil usulyny döretmek  we pugtalandyrmak. Talyplaryň ylmy gözleg başlangyçlaryny goldamak hem-de ylmyň, bilimiň we önümçiligiň üstünlikli ýakynlaşmagy üçin şertleri döretmek.
Bu teklipler ylym-bilim-önümçilik arabaglanyşygyny ösdürmäge we netijeli täzelikleriň ornaşdyrylmagyna yol açar. Şeýle çemeleşme diňe bir ýokary okuw mekdepleriniň derejesini ýokarlandyrman, eýsem pudaklaryň hem tehnologiýa taýdan ösen we bäsdeşlige ukyply bolmagyny üpjün eder.

","• Welaýat we etrap merkezlerinde muzeýleri döretmek: Ýaş nesilleri milli gymmatlyklarymyza, däp-dessurlarymyza buýsanç ruhunda, ynsanperwer kadalarymyz esasynda terbiýelemek üçin meşhur şahsyýetlerimiziň ýadygärliklerini ebedileşdirmek boýunça halkymyzyň arasynda meşhurlyk gazanan merhum şahsyýetlerimiz baradaky welaýat we etrap merkezlerinde muzeýleri döretmek.
• Yaş nesil üçin taryhy gezelenç merkezleri: Şahsyýetleriň doglan ýa-da ýaşan ýerlerinde ýörite taryhy-medeni merkezler döretmek. Bu merkezlerde ýaş nesliň şol şahsyýet barada has giňişleýin maglumat almagy we olaryň mirasy bilen içgin tanyşmagy üçin sapaklar, tanyşdyryş çäreleri, sergiler geçirilip biler.
Bu çäreler ýaş nesillerimiziň milli gymmatlyklarymyza we şahsyýetlerimiziň mirasyna bolan hormatyny artdyrar, şeýle-de olar üçin ynsanperwerlik, ahlak we medeni gymmatlyklar dogrusynda ömürlik bilim we terbiýe berer. Şeýle ýadygärlikler diňe bir geçmişiň mirasy hökmünde däl-de, ýaş nesliň milli gymmatlyklara bolan buýsanç we baglanyşyk duýgusyny kämilleşdirer.
","• Medreseleriniň taryhyny öwrenmek: Müňýyllyklardan gözbaş alýan medeniýetimizi, edebiýatymyzy, şöhratly taryhymyzy täze nazaryýet esasynda düýpli öwrenmek hem-de ylmy taýdan beýan etmek boýunça, ýurdumyzyň welaýatlarynyň çäklerindaki medreseleriniň taryhyny öwrenmek.
• Edebiyaty we taryhy wagyz etmek üçin onlaýn platformalar: Yaş nesle taryh we edebiýat baradaky maglumatlary paýlaşmak we olaryň arasyndaky baglanyşyklary ösdürmek üçin onlaýn platformalary döretmek. Bu platformalarda ýaşlaryň we alymlaryň öz pikirlerini we gözýetimlerini paýlaşmagy üçin mümkinçilik bolmaly.
Bu teklipler, medeniýetimizi, edebiýatymyzy we taryhymyzy täze nazaryýet esasynda öwrenmek, ýaş nesliň bu gymmatlyklara bolan hormatyny we baglanyşygyny ösdürmek üçin mümkinçilikler döredip biler. Şeýlelikde, ýaş nesil öz ýurdunyň taryhyna we medeniýetine bolan buýsançlaryny artdyrar we öz döredijilikleri bilen medeniýetimizi ösdürmäge goşant goşar.",,,"• Startap we innowasiýalara goldaw bermek: Telekeçileriň we ýaş alymlaryň intellektual eýeçilik hukuklary babatynda täze taslamalara goldaw bermek;
• Bilim jemgyýetçiligini ösdürmek: Okuw programmalaryna intellektual eýeçilik mowzugyny goşmak, şeýle hem mekdep we ýokary okuw jaýlarynda okuwçylara we talyplara intellektual eýeçilik düşünjesini öwretmek.
• Hünärmenleri taýýarlamak: Intellektual eýeçilik ugrundan hünärmenleri taýýarlaýan ýörite okuwlary we programmalary döretmek.
Bu teklipler, intellektual eýeçiligiň ösdürilmegini we ýurduň ykdysadyýetine hem-de bilim ulgamlaryna goşant goşmagyna mümkinçilik döreder. Bu ugurlar boýunça hyzmatdaşlygy güýçlendirmek we ösüşe ýardam bermek üçin halkara we ýerli hyzmatdaşlar bilen ýakyn hyzmatdaşlykda bolmak möhümdir.




",
40,,Türkmenbaşy şäherindäki deňizçilik orta hünär okuw mekdebi,10,-,"Bilim edaralarynyň arasynda bilelikde iş alyp barmagy höweslendirmek üçin tejribe alyşmak, ylmy barlaglary ösdürmek, şahsy we toparlaýyn okuwlary guramak bilen baglanyşykly çäreleri ýola goýmaly",-,Sanly tehnologiýalaryň elýeterliligini üpjün etmek maksady bilen degişli maliýe we tehniki goldawy artdyrmak.,-,Talyplaryň döredijiligini we aragatnaşygyny ösdürmek maksady bilen bilim edaralarynda döwrebap sanly tehnologiýalary giňden ornaşdyrmak,-,-,-,-,"Mugallymlaryň başarnyklaryny yzygiderli kämilleşdirmek üçin ýokary hilli tälim okuwlaryny guramak. Durmuş we tehnologik özgertmeleri özleşdirmekde, mugallymlaryň çalt uýgunlaşmagy üçin ýörite çäreleri guramak",-,-,-,-,-,
41,,Türkmenabat derýaçylyk orta hünär okuw mekdebi,10,,"Bilim edaralarynyň arasynda bilelikde iş alyp barmagy höweslendirmek üçin tejribe alyşmak, ylmy barlaglary ösdürmek, şahsy we toparlaýyn okuwlary guramak bilen baglanyşykly çäreleri ýola goýmaly",,"Talyplaryň döredijiligini we aragatnaşygyny ösdürmek maksady bilen bilim edaralarynda döwrebap sanly tehnologiýalary giňden ornaşdyrmak. Bilim ulgamyny innowasiýalar arkaly kämilleşdirip, dürli bilim edaralary bilen özara online okuw sapaklaryny yzygiderli geçirmekligi  ýola goýmak.",, Talyplar we mugallymlar üçin islendik wagtda internete girmek hem-de döwrebap enjamlar bilen üpjün etmek. Sanly tehnologiýalaryň elýeterliligini üpjün etmek maksady bilen degişli maliýe we tehniki goldawy artdyrmak.,,,,,       Mugallymlaryň öz pikirlerini we tejribelerini bilim işinde giňden ulanyp bilmekleri üçin dolandyryş ulgamynda döredijilik azatlygyny goldamak. Mugallymlaryň iş tejribesini kämilleşdirmek üçin  daşary ýurt döwletlerine okuwa ugratmaklyk.,,,,,,
42,,“Türkmenhimiýa” döwlet konserniniň Türkmenabat şäherindäki Tehniki orta hünär okuw mekdebinyň w.w.ý.ý.,7,"Türkmen halkynyň Milli Lideri Gahryman Arkadagymyzyň, Arkadagly Gahryman Serdarymyzyň sargytlaryny, halkymyzyň watançylyk, dost-doganlyk, agzybirlik, jebislik, ýörelgelerini ýaş nesillerimiziň aňyna siňdirip, olary watançylyk ruhunda terbiýelemek,  jemgyýetde arassa ýaşamaga, durmuşda öz ýoluňy özbaşdak saýlap, höwes edip saýlan hünärine eýe bolup, döredijilikli we yhlasly zähmet çekmäge, eziz Watanymyzyň gülläp ösmegine mynasyp goşant goşmaga taýýarlamak maksady bilen talyp ýaşlaryň arasynda yzygiderli gürrüňdelişlikleri geçirmeli",,,,,"Ylmyň, tehnikanyň örän çalt depginlerde ösmegi, täze tehnogiýalaryň döremegi bilen baglylykda bilim edaralarynda okatmagyň usulyýetini kämilleşdirmek maksady bilen, hünärler boýunça okuw meýilnamalary we maksatnamalary kämilleşdirmeli",,,,,,,,,,,"1.Mekdepde bilim ulgamynyň ösüşini ylmy-usuly taýdan üpjün etmek maksady bilen, ýaş alymlary taýýarlamak hem-de mugallymlaryň hünärini ýokarlandyryş ulgamyny kämilleşdirmeli;                                                                                                                   2. 2025-nji ýyl üçin okuwa kabul etmegiň meýilnamalarynyň taslamasyny taýýarlamak üçin Lebap welaýat ilatyň Zähmet we  iş üpjünçilik müdürligi we “Türkmenhimiýa” döwlet konserniniň garamagyndaky edara-kärhanalary bilen ýakyndan işläp, boş iş orunlary we geljekde zerur boljak hünärleri we olaryň zerur sanlaryny kesgitlemeli we mekdepde ýaşlary hünäre ugrukdyrmak işlerini ýokary derejede guramaçylykly alyp barmak boýunça Guramaçylyk iş topary zähmet bazarynda işçi hünärmenlere, orta hünär bilimli hünärmenlere bolan islegleri öwrenmeli;                                                                                                    3. Mekdebiň gazanan üstünliklerini mahabatlandyrýan mekdep barada maglumatlary özünde jemleýän bukletleri, prezentasiýalary we beýleki maglumat saklaýjylary taýýarlamaly we ýaýratmaly;
4. Mekdepde talyplaryň edebine we terbiýesine ünsi gowşatmazlyk maksady bilen, okuw toparlarynda terbiýeçilik gürrüňdeşligini we Internet ulgamynda sosial torlarda ýaýradylýan we mahabatlandyrylýan, zyýanly maglumatlardan talyp ýaşlary ägä etmek boýunça düşündiriş işlerini yzygiderli geçirmeli;
5. Mekdepde amaly häsiýetli ylmy barlaglary we özbaşdak ylmy işleri alyp barmak üçin döredilen “Ýaş alymlar klubynyň” işini has-da kämilleşdirmeli.
"
43,,Mary şäherindäki jemagat hojalygy orta hünär okuw mekdebi,10,"Mugallymçylyk kärini kämilleşdirmek, şahsy iş meýilnamalarynda okuw-usuly, guramaçylyk-usuly, ylmy-barlag we terbiýeçilik işleri, şeýle hem işiň beýleki görnüşleri üçin meýilleşdirilen sagatlary özara öwrenmek. Bu ugurda mugallymyň işiniň öndürijiligini ýokarlandyrmak.","Mary welaýatynyň orta hünär okuw mekdeplerinde öwredilýän dersleriň birmeňzeşleri boýunça okatmagyň öňdebaryjy tejribelerini umumylaşdyryp, okuw işine ornaşdyrmak. DUAL bilim maksatnamalaryny okuw işine ornaşdyrmagyň mümkinçiliklerini düýpli öwrenmek. ",Orta hünär bilim maksatnamalaryny hünärleri özleşdirmegiň okuw meýilnamalaryny kämilleşdirmek. Döwrüň talaplaryna laýyk gelýän dersleri öwrenmegiň mümkinçiliklerini seljermek. Maýyplar üçin onlaýn hünär bilimiň elýeterliligini üpjün etmek.,Döwlet bilim edaralarynda tölegsiz orta hünär bilimi ýola goýmak hem-de bilime berilýän döwlet maliýe goldawyny güýçlendirmek.,,"Sanly bilimiň mümkinçiligini deňleşdirmek üçin talyplara we mugallymlara islendik wagtda, islendik ýerde internete girmek we enjamlary ulanmak mümkinçiligini döretmek. ",,,,,,"Bilim edaralary mugallymlaryň hünär şahsyýetini kämilleşdirmäge şert döretmeli, hünär taýdan dowamly ösüşini ýeňilleşdirmäge we talyplar bilen okuw işini alyp barmakda mugallymlara öz pikirlerini we tejribelerini netijeli ulanmaga mümkinçilik berýän dolandyryş işlerini amala aşyrmak. ",,,,,
44,,Türkmenaragatnaşyk agentliginiň Politehniki orta hünär okuw mekdebi,5,Ýurdumyzda alyp barylýan syýasy we jemgyýetçilik wakalaryň talyplaryň arasyndaky hepdelik tanyşdyrylyşy  ,Talyplar we mugallymlar üçin üznüksiz internet elýeterliligini üpjün etmek hem-de döwrebap enmjamlar bilen üpjçn etmek boýunça işleri geçirmek,,,,1.Bilimiň hilini has-da ýokarlandyrmak maksady bilen degişli gurnaklary döretmek we talyplarda höwes döretmek,,,,,,"1.	Ýadygärliklere gezelençleri, duşuşyklary, meşhur şahsyýetlerimiziň ömri we döredijiligi barada bäsleşikleri yzygiderli geçirmek. ",1.	Taryhy bilimli söhbetdeşlikleri yzygiderli geçirmek.,,,,
45,,Türkmen döwlet neşirýat gullugynyň Neşirýat-çaphana orta hünär okuw mekdebi,2,,Okuw mekdebinde häzirki öwredilýän hünärleri kämilleşdirmek.,,,,,,,,,,,Okuw mekdebinde çaphana işi boýunça müzeý döretmek,,,,